{
  "slice_id": "gc10-s1",
  "catalog_id": "pressure-catalog/gc10-s1",
  "attempt": {
    "pressure_class": "resource_scarcity",
    "authorizer": "schedule",
    "cycle": 8,
    "activate_event": "ENTITY_UPDATE",
    "rubber_band": true,
    "targeting": { "rubber_band": true }
  },
  "expected": {
    "outcome": "REJECT",
    "reason": "RUBBER_BAND",
    "note": "GC10 is not a difficulty cheat layer."
  }
}
